{
  "$schema": "https://json-schema.org/draft/2020-12/schema",
  "$id": "https://0thcanvas.com/schemas/capability-packet.schema.json",
  "title": "Bounded worker capability packet",
  "type": "object",
  "additionalProperties": false,
  "required": [
    "objective",
    "independent",
    "ordered",
    "mutation_scope",
    "shared_mutable_state",
    "evidence_advantage",
    "work_kind",
    "compute_class",
    "escalation_class",
    "task_risk",
    "budget",
    "output_schema"
  ],
  "properties": {
    "capability": { "type": "string", "minLength": 1 },
    "objective": { "type": "string", "minLength": 1 },
    "independent": { "type": "boolean" },
    "ordered": { "type": "boolean" },
    "mutation_scope": { "enum": ["read-only", "mutable"] },
    "shared_mutable_state": { "type": "boolean" },
    "evidence_advantage": { "type": "string", "minLength": 1 },
    "work_kind": {
      "enum": [
        "source_discovery",
        "evidence_extraction",
        "test_execution",
        "log_condensation",
        "bounded_implementation",
        "routine_review",
        "cross_source_synthesis",
        "architecture",
        "high_risk_implementation"
      ]
    },
    "compute_class": { "enum": ["auto", "economy", "balanced", "frontier", "inherit"] },
    "escalation_class": { "type": ["string", "null"], "enum": [null, "balanced", "frontier"] },
    "task_risk": { "enum": ["low", "medium", "high", "critical"] },
    "budget": {
      "type": "object",
      "additionalProperties": false,
      "required": ["max_workers", "max_rounds"],
      "properties": {
        "max_workers": { "type": "integer", "minimum": 1 },
        "max_rounds": { "type": "integer", "minimum": 1 }
      }
    },
    "output_schema": { "type": "string", "minLength": 1 }
  }
}
